{
  "$schema": "https://graphregistry.pages.dev/TheGraphNetworksRegistrySchema_v0_2.json",
  "version": "0.2.13",
  "title": "The Graph networks registry",
  "description": "This registry was generated and validated. Do NOT edit it manually.",
  "updatedAt": "2024-11-07T15:09:05.499Z",
  "networks": [
    {
      "id": "mainnet",
      "shortName": "Ethereum",
      "fullName": "Ethereum Mainnet",
      "aliases": [
        "ethereum",
        "eth",
        "eth-mainnet",
        "evm-1"
      ],
      "caip2Id": "eip155:1",
      "graphNode": {
        "protocol": "ethereum"
      },
      "explorerUrls": [
        "https://etherscan.io"
      ],
      "rpcUrls": [
        "https://rpc.ankr.com/eth",
        "https://mainnet.infura.io/v3/{INFURA_API_KEY}"
      ],
      "apiUrls": [
        {
          "url": "https://api.etherscan.io/api",
          "kind": "etherscan"
        },
        {
          "url": "https://eth.blockscout.com/api",
          "kind": "blockscout"
        }
      ],
      "networkType": "mainnet",
      "support": {
        "subgraphs": [
          {
            "provider": "e&n"
          }
        ],
        "sps": [
          {
            "provider": "e&n"
          }
        ],
        "firehose": [
          {
            "provider": "pinax",
            "url": "eth.firehose.pinax.network:443"
          },
          {
            "provider": "streamingfast",
            "url": "mainnet.eth.streamingfast.io:443"
          }
        ],
        "substreams": [
          {
            "provider": "pinax",
            "url": "eth.substreams.pinax.network:443"
          },
          {
            "provider": "streamingfast",
            "url": "mainnet.eth.streamingfast.io:443"
          }
        ]
      },
      "issuanceRewards": true,
      "nativeToken": "ETH",
      "docsUrl": "https://ethereum.org/en/developers/docs/",
      "indexerDocsUrls": [
        {
          "url": "https://docs.infradao.com/archive-nodes-101/ethereum",
          "kind": "rpc"
        }
      ],
      "web3Icon": "ethereum",
      "genesis": {
        "hash": "0xd4e56740f876aef8c010b86a40d5f56745a118d0906a34e69aec8c0db1cb8fa3",
        "height": 0
      },
      "firehose": {
        "blockType": "sf.ethereum.type.v2.Block",
        "evmExtendedModel": true,
        "bufUrl": "https://buf.build/streamingfast/firehose-ethereum",
        "bytesEncoding": "hex"
      }
    },
    {
      "id": "optimism",
      "shortName": "Optimism",
      "fullName": "OP Mainnet",
      "aliases": [
        "evm-10",
        "op-mainnet"
      ],
      "caip2Id": "eip155:10",
      "graphNode": {
        "protocol": "ethereum"
      },
      "relations": [
        {
          "kind": "l2Of",
          "network": "mainnet"
        }
      ],
      "explorerUrls": [
        "https://optimistic.etherscan.io/"
      ],
      "rpcUrls": [
        "https://mainnet.optimism.io",
        "https://optimism.drpc.org"
      ],
      "apiUrls": [
        {
          "url": "https://optimism.abi.pinax.network/api",
          "kind": "etherscan"
        }
      ],
      "support": {
        "subgraphs": [
          {
            "provider": "e&n"
          }
        ],
        "sps": [
          {
            "provider": "e&n"
          }
        ],
        "firehose": [
          {
            "provider": "streamingfast",
            "url": "opt-mainnet.streamingfast.io:443"
          }
        ],
        "substreams": [
          {
            "provider": "streamingfast",
            "url": "opt-mainnet.streamingfast.io:443"
          }
        ]
      },
      "networkType": "mainnet",
      "issuanceRewards": true,
      "nativeToken": "ETH",
      "docsUrl": "https://docs.optimism.io/",
      "indexerDocsUrls": [
        {
          "url": "https://docs.infradao.com/archive-nodes-101/optimism",
          "kind": "rpc"
        }
      ],
      "web3Icon": "optimistic-ethereum",
      "genesis": {
        "hash": "0x7ca38a1916c42007829c55e69d3e9a73265554b586a499015373241b8a3fa48b",
        "height": 0
      },
      "firehose": {
        "blockType": "sf.ethereum.type.v2.Block",
        "evmExtendedModel": false,
        "bufUrl": "https://buf.build/streamingfast/firehose-ethereum",
        "bytesEncoding": "hex"
      }
    },
    {
      "id": "gnosis",
      "shortName": "Gnosis",
      "fullName": "Gnosis Mainnet",
      "aliases": [
        "evm-100",
        "gnosis-mainnet"
      ],
      "caip2Id": "eip155:100",
      "graphNode": {
        "protocol": "ethereum"
      },
      "explorerUrls": [
        "https://gnosisscan.io",
        "https://gnosis.blockscout.com"
      ],
      "rpcUrls": [
        "https://rpc.gnosischain.com",
        "https://rpc.gnosis.gateway.fm",
        "https://rpc.ankr.com/gnosis"
      ],
      "apiUrls": [
        {
          "url": "https://gnosis.abi.pinax.network/api",
          "kind": "etherscan"
        }
      ],
      "support": {
        "subgraphs": [
          {
            "provider": "e&n"
          }
        ]
      },
      "networkType": "mainnet",
      "issuanceRewards": true,
      "nativeToken": "XDAI",
      "docsUrl": "https://docs.gnosischain.com",
      "indexerDocsUrls": [
        {
          "url": "https://docs.infradao.com/archive-nodes-101/gnosis",
          "kind": "rpc"
        }
      ],
      "web3Icon": "gnosis",
      "genesis": {
        "hash": "0x4f1dd23188aab3a76b463e4af801b52b1248ef073c648cbdc4c9333d3da79756",
        "height": 0
      },
      "firehose": {
        "blockType": "sf.ethereum.type.v2.Block",
        "evmExtendedModel": false,
        "bufUrl": "https://buf.build/streamingfast/firehose-ethereum",
        "bytesEncoding": "hex"
      }
    },
    {
      "id": "gnosis-chiado",
      "shortName": "Gnosis Chiado",
      "fullName": "Gnosis Chiado Testnet",
      "aliases": [
        "chiado"
      ],
      "caip2Id": "eip155:10200",
      "graphNode": {
        "protocol": "ethereum"
      },
      "explorerUrls": [
        "https://blockscout.chiadochain.net"
      ],
      "rpcUrls": [
        "https://rpc.chiadochain.net"
      ],
      "apiUrls": [
        {
          "url": "https://gnosis-chiado.blockscout.com/api",
          "kind": "etherscan"
        }
      ],
      "support": {
        "subgraphs": [
          {
            "provider": "e&n"
          }
        ]
      },
      "networkType": "testnet",
      "relations": [
        {
          "kind": "testnetOf",
          "network": "gnosis"
        }
      ],
      "issuanceRewards": false,
      "nativeToken": "XDAI",
      "docsUrl": "https://docs.gnosischain.com",
      "web3Icon": "gnosis",
      "genesis": {
        "hash": "0xada44fd8d2ecab8b08f256af07ad3e777f17fb434f8f8e678b312f576212ba9a",
        "height": 0
      },
      "firehose": {
        "blockType": "sf.ethereum.type.v2.Block",
        "evmExtendedModel": false,
        "bufUrl": "https://buf.build/streamingfast/firehose-ethereum",
        "bytesEncoding": "hex"
      }
    },
    {
      "id": "polygon-zkevm",
      "shortName": "Polygon zkEVM",
      "fullName": "Polygon zkEVM Mainnet",
      "aliases": [],
      "caip2Id": "eip155:1101",
      "graphNode": {
        "protocol": "ethereum"
      },
      "relations": [
        {
          "kind": "l2Of",
          "network": "mainnet"
        }
      ],
      "explorerUrls": [
        "https://zkevm.polygonscan.com"
      ],
      "rpcUrls": [
        "https://zkevm-rpc.com",
        "https://polygon-zkevm.drpc.org"
      ],
      "apiUrls": [
        {
          "url": "https://polygon-zkevm.abi.pinax.network/api",
          "kind": "etherscan"
        }
      ],
      "networkType": "mainnet",
      "support": {
        "subgraphs": [
          {
            "provider": "e&n"
          }
        ]
      },
      "issuanceRewards": false,
      "nativeToken": "ETH",
      "docsUrl": "https://polygon.technology/polygon-zkevm",
      "web3Icon": "polygon-zkevm",
      "genesis": {
        "hash": "0x81005434635456a16f74ff7023fbe0bf423abbc8a8deb093ffff455c0ad3b741",
        "height": 0
      },
      "firehose": {
        "blockType": "sf.ethereum.type.v2.Block",
        "evmExtendedModel": false,
        "bufUrl": "https://buf.build/streamingfast/firehose-ethereum",
        "bytesEncoding": "hex"
      }
    },
    {
      "id": "sepolia",
      "shortName": "Ethereum Sepolia",
      "fullName": "c",
      "aliases": [
        "evm-11155111"
      ],
      "caip2Id": "eip155:11155111",
      "networkType": "testnet",
      "relations": [
        {
          "kind": "testnetOf",
          "network": "mainnet"
        }
      ],
      "graphNode": {
        "protocol": "ethereum"
      },
      "explorerUrls": [
        "https://sepolia.etherscan.io/",
        "https://sepolia.otterscan.io"
      ],
      "rpcUrls": [
        "https://rpc.sepolia.org",
        "https://sepolia.infura.io/v3/${INFURA_API_KEY}"
      ],
      "apiUrls": [],
      "support": {
        "subgraphs": [
          {
            "provider": "e&n"
          }
        ],
        "sps": [
          {
            "provider": "e&n"
          }
        ],
        "firehose": [
          {
            "provider": "pinax",
            "url": "sepolia.firehose.pinax.network:443"
          },
          {
            "provider": "streamingfast",
            "url": "sepolia.eth.streamingfast.io:443"
          }
        ],
        "substreams": [
          {
            "provider": "pinax",
            "url": "sepolia.substreams.pinax.network:443"
          },
          {
            "provider": "streamingfast",
            "url": "sepolia.eth.streamingfast.io:443"
          }
        ]
      },
      "issuanceRewards": false,
      "nativeToken": "ETH",
      "docsUrl": "https://sepolia.dev/",
      "genesis": {
        "hash": "0x25a5cc106eea7138acab33231d7160d69cb777ee0c2c553fcddf5138993e6dd9",
        "height": 0
      },
      "firehose": {
        "blockType": "sf.ethereum.type.v2.Block",